{
	"reviewedCommit": "0206d4e5a19da366fedf5910c67a97c93c845b59",
	"baselineVersion": "playwright-1.59.1-noble-linux-amd64",
	"containerImage": "mcr.microsoft.com/playwright@sha256:eac9b0a5312cdab40ee8c2429df5bf19bffdccf8f3bf3c42268e173f97541645",
	"imageDigest": "sha256:eac9b0a5312cdab40ee8c2429df5bf19bffdccf8f3bf3c42268e173f97541645",
	"reviewedAt": "2026-08-27T00:00:00+09:00",
	"reviewer": "Independent Product / UI Rubric Reviewer",
	"decision": "APPROVE",
	"notes": "Independent human review approved all 18 baselines: 3 profiles × 3 widths × 2 themes. Scores: Design 8.1, Originality 7.0, Craft 7.5, Functionality 8.4.",
	"screenshots": [
		{
			"file": "calm-dark-desktop.png",
			"sha256": "5f8a52894429a8b2bb9174736eeaa1d5440b6f99c1a70057bc4a68e19040bdc6"
		},
		{
			"file": "calm-dark-mobile.png",
			"sha256": "51a9c87d25e0a83ac04d71901ad9e3da637731ac69a1d1993ef0b9b4ad794ceb"
		},
		{
			"file": "calm-dark-tablet.png",
			"sha256": "25c5bd004d74087936401c54a32699dbf3f4c9f962cacfe640d0918c89eed681"
		},
		{
			"file": "calm-light-desktop.png",
			"sha256": "11fe3295ebd0dfee9fd10938e46e28a5ea94cfe0aed84465f2d13932900d7324"
		},
		{
			"file": "calm-light-mobile.png",
			"sha256": "2d46e2b5672f86edeea64c341507c7d7792435f358564ba06c44f1207a3fbec7"
		},
		{
			"file": "calm-light-tablet.png",
			"sha256": "e85d1db8f09058213376d9df590951190fce0dc60fd846414bb20b5d4bc2ecc6"
		},
		{
			"file": "classic-dark-desktop.png",
			"sha256": "58d4543a860e506590514dc8a45da856b3cad3f87af6a3d785e53cae162aa660"
		},
		{
			"file": "classic-dark-mobile.png",
			"sha256": "8072abeea4ca578f3b457b0e5f31fd9a508c6adf834076a7f8c3300259289ab7"
		},
		{
			"file": "classic-dark-tablet.png",
			"sha256": "ed7928119157a01b5478f131f8cb53c12b2dcad674ee24974cb5429d193ce476"
		},
		{
			"file": "classic-light-desktop.png",
			"sha256": "04f7b8532c6eda43c13c0caeef168fed5e490a70a8169606e13a82d79ef17675"
		},
		{
			"file": "classic-light-mobile.png",
			"sha256": "227fac37409e9fe83ede8865ccb02c71c5801e043242b543c84fe7490e9bba2f"
		},
		{
			"file": "classic-light-tablet.png",
			"sha256": "11604fd2ec43245a635540b79b50a6a2fa55c1f9e99dea2e4426cf73724f6f40"
		},
		{
			"file": "command-dark-desktop.png",
			"sha256": "a616a40c661cd864bf706b4d0809f9dc56def7a1e9fde0e3bf6b59427d541eab"
		},
		{
			"file": "command-dark-mobile.png",
			"sha256": "3000e899d9346332b3e4c2bf01554a2b55acc6cf41accbc4317e62ad63cb26e3"
		},
		{
			"file": "command-dark-tablet.png",
			"sha256": "8ded5727f87d6e0f36b63f59b78a832d04cf9f00d1aeccd5a9d7bd5577c8ae29"
		},
		{
			"file": "command-light-desktop.png",
			"sha256": "46f7bc4ca09ff20bfbd22c95fca727761e8fb1644b53ffe4e5df9ee8b680c61f"
		},
		{
			"file": "command-light-mobile.png",
			"sha256": "9a744604c441517518061b211d723f748f03c67416fe74c5118d18e00f8a0ee0"
		},
		{
			"file": "command-light-tablet.png",
			"sha256": "23ac634b997e785ddff997313ccd45076523acfe407c36eb1c6351c3172810cd"
		}
	]
}
